{
  "id": "default",
  "table": "chassis_brake_validation_specs",
  "display": "table",
  "columns": [
    {
      "name": "test_id",
      "label": "Test ID"
    },
    {
      "name": "vehicle_variant",
      "label": "Vehicle Variant"
    },
    {
      "name": "axle_config",
      "label": "Axle Config"
    },
    {
      "name": "front_spring_rate_n_mm",
      "label": "Front Spring Rate",
      "format": "number",
      "unitLabel": "N/mm"
    },
    {
      "name": "rear_spring_rate_n_mm",
      "label": "Rear Spring Rate",
      "format": "number",
      "unitLabel": "N/mm"
    },
    {
      "name": "damping_front_ns_m",
      "label": "Front Damping",
      "format": "number",
      "unitLabel": "Ns/m"
    },
    {
      "name": "damping_rear_ns_m",
      "label": "Rear Damping",
      "format": "number",
      "unitLabel": "Ns/m"
    },
    {
      "name": "tire_size",
      "label": "Tire Size"
    },
    {
      "name": "rotor_front_mm",
      "label": "Front Rotor",
      "format": "number",
      "unitLabel": "mm"
    },
    {
      "name": "rotor_rear_mm",
      "label": "Rear Rotor",
      "format": "number",
      "unitLabel": "mm"
    },
    {
      "name": "stop_distance_100_0_m",
      "label": "Stop Distance 100-0",
      "format": "number",
      "unitLabel": "m"
    },
    {
      "name": "lateral_grip_g",
      "label": "Lateral Grip",
      "format": "number",
      "unitLabel": "g"
    },
    {
      "name": "stability_margin_pct",
      "label": "Stability Margin",
      "format": "number",
      "unitLabel": "%"
    },
    {
      "name": "validation_date",
      "label": "Validation Date",
      "format": "date"
    },
    {
      "name": "regulatory_brake_pass",
      "label": "Regulatory Brake Pass"
    },
    {
      "name": "fade_test_pass",
      "label": "Fade Test Pass"
    },
    {
      "name": "gcwr_stop_distance_m",
      "label": "GCWR Stop Distance",
      "format": "number",
      "unitLabel": "m"
    },
    {
      "name": "trailer_stability_pass",
      "label": "Trailer Stability Pass"
    },
    {
      "name": "grade_launch_pass",
      "label": "Grade Launch Pass"
    }
  ]
}
