{
  "id": "default",
  "table": "battery_pack_module_specs",
  "display": "table",
  "columns": [
    {
      "name": "pack_id",
      "label": "Pack ID"
    },
    {
      "name": "chemistry",
      "label": "Chemistry"
    },
    {
      "name": "series_cells",
      "label": "Series Cells",
      "format": "number"
    },
    {
      "name": "parallel_cells",
      "label": "Parallel Cells",
      "format": "number"
    },
    {
      "name": "nominal_voltage_v",
      "label": "Nominal Voltage",
      "format": "number",
      "unitLabel": "V"
    },
    {
      "name": "capacity_kwh",
      "label": "Capacity",
      "format": "number",
      "unitLabel": "kWh"
    },
    {
      "name": "module_count",
      "label": "Module Count",
      "format": "number"
    },
    {
      "name": "cell_capacity_ah",
      "label": "Cell Capacity",
      "format": "number",
      "unitLabel": "Ah"
    },
    {
      "name": "peak_discharge_kw",
      "label": "Peak Discharge",
      "format": "number",
      "unitLabel": "kW"
    },
    {
      "name": "continuous_charge_kw",
      "label": "Continuous Charge",
      "format": "number",
      "unitLabel": "kW"
    },
    {
      "name": "coolant_flow_l_min",
      "label": "Coolant Flow",
      "format": "number",
      "unitLabel": "L/min"
    },
    {
      "name": "mass_kg",
      "label": "Mass",
      "format": "number",
      "unitLabel": "kg"
    },
    {
      "name": "estimated_range_km",
      "label": "Estimated Range",
      "format": "number",
      "unitLabel": "km"
    },
    {
      "name": "bms_firmware_version",
      "label": "BMS Firmware Version"
    }
  ]
}
